{
  "$schema": "https://json-schema.org/draft/2020-12/schema",
  "$id": "sley.lint.report.v0",
  "title": "Sley Lint Report v0",
  "type": "object",
  "required": ["schema", "status", "entry_module", "filters", "findings"],
  "properties": {
    "schema": { "const": "sley.lint.report.v0" },
    "status": { "enum": ["ok", "findings"] },
    "entry_module": { "type": "string" },
    "filters": {
      "type": "object",
      "required": ["module", "rules"],
      "properties": {
        "module": { "type": ["string", "null"] },
        "rules": {
          "type": "array",
          "items": {
            "enum": [
              "unused_private_task",
              "unreachable_private_task",
              "unused_declared_effect",
              "unused_import",
              "unused_take",
              "unused_private_type",
              "unused_private_effect",
              "raw_host_adapter",
              "missing_module_declaration",
              "unchecked_result",
              "unqualified_imported_call",
              "unused_pure_binding",
              "unused_pure_expression_statement",
              "mutable_binding_never_set",
              "constant_if_expression",
              "constant_if_statement",
              "constant_false_while_statement",
              "constant_comparison_expression",
              "constant_arithmetic_expression",
              "constant_text_concatenation_expression",
              "constant_list_index_expression",
              "constant_map_index_expression",
              "constant_record_field_access_expression",
              "constant_len_expression",
              "constant_not_expression",
              "empty_if_statement",
              "empty_for_statement",
              "empty_forge_statement",
              "identity_binary_expression",
              "redundant_boolean_comparison",
              "absorbing_boolean_expression",
              "self_comparison_expression",
              "double_negation_expression",
              "negated_comparison_expression",
              "redundant_boolean_if_expression",
              "redundant_boolean_if_statement",
              "same_branch_if_expression",
              "same_branch_if_statement",
              "unreachable_statement"
            ]
          },
          "uniqueItems": true
        }
      },
      "additionalProperties": false
    },
    "findings": {
      "type": "array",
      "items": {
        "type": "object",
        "required": [
          "id",
          "rule",
          "severity",
          "message",
          "node",
          "module",
          "hint"
        ],
        "properties": {
          "id": {
            "enum": [
              "UNUSED_PRIVATE_TASK",
              "UNREACHABLE_PRIVATE_TASK",
              "UNUSED_DECLARED_EFFECT",
              "UNUSED_IMPORT",
              "UNUSED_TAKE",
              "UNUSED_PRIVATE_TYPE",
              "UNUSED_PRIVATE_EFFECT",
              "RAW_HOST_ADAPTER",
              "MISSING_MODULE_DECLARATION",
              "UNCHECKED_RESULT",
              "UNQUALIFIED_IMPORTED_CALL",
              "UNUSED_PURE_BINDING",
              "UNUSED_PURE_EXPRESSION_STATEMENT",
              "MUTABLE_BINDING_NEVER_SET",
              "CONSTANT_IF_EXPRESSION",
              "CONSTANT_IF_STATEMENT",
              "CONSTANT_FALSE_WHILE_STATEMENT",
              "CONSTANT_COMPARISON_EXPRESSION",
              "CONSTANT_ARITHMETIC_EXPRESSION",
              "CONSTANT_TEXT_CONCATENATION_EXPRESSION",
              "CONSTANT_LIST_INDEX_EXPRESSION",
              "CONSTANT_MAP_INDEX_EXPRESSION",
              "CONSTANT_RECORD_FIELD_ACCESS_EXPRESSION",
              "CONSTANT_LEN_EXPRESSION",
              "CONSTANT_NOT_EXPRESSION",
              "EMPTY_IF_STATEMENT",
              "EMPTY_FOR_STATEMENT",
              "EMPTY_FORGE_STATEMENT",
              "IDENTITY_BINARY_EXPRESSION",
              "REDUNDANT_BOOLEAN_COMPARISON",
              "ABSORBING_BOOLEAN_EXPRESSION",
              "SELF_COMPARISON_EXPRESSION",
              "DOUBLE_NEGATION_EXPRESSION",
              "NEGATED_COMPARISON_EXPRESSION",
              "REDUNDANT_BOOLEAN_IF_EXPRESSION",
              "REDUNDANT_BOOLEAN_IF_STATEMENT",
              "SAME_BRANCH_IF_EXPRESSION",
              "SAME_BRANCH_IF_STATEMENT",
              "UNREACHABLE_STATEMENT"
            ]
          },
          "rule": {
            "enum": [
              "unused_private_task",
              "unreachable_private_task",
              "unused_declared_effect",
              "unused_import",
              "unused_take",
              "unused_private_type",
              "unused_private_effect",
              "raw_host_adapter",
              "missing_module_declaration",
              "unchecked_result",
              "unqualified_imported_call",
              "unused_pure_binding",
              "unused_pure_expression_statement",
              "mutable_binding_never_set",
              "constant_if_expression",
              "constant_if_statement",
              "constant_false_while_statement",
              "constant_comparison_expression",
              "constant_arithmetic_expression",
              "constant_text_concatenation_expression",
              "constant_list_index_expression",
              "constant_map_index_expression",
              "constant_record_field_access_expression",
              "constant_len_expression",
              "constant_not_expression",
              "empty_if_statement",
              "empty_for_statement",
              "empty_forge_statement",
              "identity_binary_expression",
              "redundant_boolean_comparison",
              "absorbing_boolean_expression",
              "self_comparison_expression",
              "double_negation_expression",
              "negated_comparison_expression",
              "redundant_boolean_if_expression",
              "redundant_boolean_if_statement",
              "same_branch_if_expression",
              "same_branch_if_statement",
              "unreachable_statement"
            ]
          },
          "severity": { "enum": ["warning"] },
          "message": { "type": "string" },
          "node": { "type": "string" },
          "module": { "type": "string" },
          "hint": { "type": "string" }
        },
        "additionalProperties": false
      }
    }
  },
  "additionalProperties": false
}
